{
  "schema": "evalsuite.resolution.v0",
  "schema_version": "0.0.0",
  "suite_id": "example_suite",
  "suite_version": "0.1.0",
  "suite_sha256": "sha256:0000000000000000000000000000000000000000000000000000000000000000",
  "catalog_version": "catalog.v0",
  "db_fingerprint_sha256": "sha256:1111111111111111111111111111111111111111111111111111111111111111",
  "taxonomy_id": "taxonomy.v0",
  "taxonomy_version": "0.0.0",
  "resolved_count": 0,
  "resolved_asset_ids_sha256": "sha256:2222222222222222222222222222222222222222222222222222222222222222",
  "resolved_asset_ids_path": "artifacts/evalsuite/example_suite/0.1.0/resolved_asset_ids.txt",
  "created_at_utc": "2026-02-27T00:00:00Z"
}
